{
  "task_id": "boot-02t", "project_id": "panshi-demo",
  "request": "两组渗透率数据，A组和B组差异很小但样本量很大。分析差异的统计显著性和工程显著性，给出效应量、置信区间和工程判定。",
  "skill_version": "1.0.0", "controller_version": "obsidian-ctl-0.1.0",
  "timestamp": "2026-08-06T15:10:00Z", "risk_level": "medium",
  "human_approval_state": "not_required", "requested_output_format": "json",
  "constraints": {"engineering_thresholds": {"k": {"min": 5e-7, "max": 2e-6, "unit": "m/s"}}},
  "data_columns": [
    {"name": "specimen", "role": "id", "data_type": "string", "sampling_unit": "specimen"},
    {"name": "group", "role": "treatment", "data_type": "string"},
    {"name": "k", "role": "response", "data_type": "number", "unit": "m/s"}
  ],
  "samples": [
    {"specimen": "A01", "group": "A", "k": 1.00e-6},{"specimen": "A02", "group": "A", "k": 1.01e-6},
    {"specimen": "A03", "group": "A", "k": 0.99e-6},{"specimen": "A04", "group": "A", "k": 1.00e-6},
    {"specimen": "A05", "group": "A", "k": 1.02e-6},{"specimen": "A06", "group": "A", "k": 1.00e-6},
    {"specimen": "A07", "group": "A", "k": 0.98e-6},{"specimen": "A08", "group": "A", "k": 1.01e-6},
    {"specimen": "A09", "group": "A", "k": 1.00e-6},{"specimen": "A10", "group": "A", "k": 1.01e-6},
    {"specimen": "A11", "group": "A", "k": 0.99e-6},{"specimen": "A12", "group": "A", "k": 1.00e-6},
    {"specimen": "A13", "group": "A", "k": 1.01e-6},{"specimen": "A14", "group": "A", "k": 1.00e-6},
    {"specimen": "A15", "group": "A", "k": 1.00e-6},
    {"specimen": "B01", "group": "B", "k": 1.20e-6},{"specimen": "B02", "group": "B", "k": 1.21e-6},
    {"specimen": "B03", "group": "B", "k": 1.19e-6},{"specimen": "B04", "group": "B", "k": 1.20e-6},
    {"specimen": "B05", "group": "B", "k": 1.22e-6},{"specimen": "B06", "group": "B", "k": 1.20e-6},
    {"specimen": "B07", "group": "B", "k": 1.18e-6},{"specimen": "B08", "group": "B", "k": 1.21e-6},
    {"specimen": "B09", "group": "B", "k": 1.20e-6},{"specimen": "B10", "group": "B", "k": 1.21e-6},
    {"specimen": "B11", "group": "B", "k": 1.19e-6},{"specimen": "B12", "group": "B", "k": 1.20e-6},
    {"specimen": "B13", "group": "B", "k": 1.21e-6},{"specimen": "B14", "group": "B", "k": 1.20e-6},
    {"specimen": "B15", "group": "B", "k": 1.20e-6}
  ]
}
